news_headline,news_article,news_category
Harvard University received ₹64 crore from sex offender Epstein,"Harvard University received nearly $9 million (₹64 crore) in donations from convicted sex offender Jeffrey Epstein before his 2008 guilty plea to sex charges, but rejected a proposed gift after his conviction, according to institution's President Lawrence Bacow. Epstein killed himself in a US jail in August after being arrested on charges of sex trafficking of young women and girls.",world
Fires at Saudi Aramco oil facilities after drone attacks,"Drone attacks on two oil facilities owned by Saudi Arabia's state-owned oil giant Saudi Aramco in Abqaiq and Khurais provinces on Saturday caused fires, a Saudi interior ministry spokesman said without identifying the source of the drones. A Saudi-led military coalition has been battling Yemen's Houthis rebels since March 2015, and the latter have launched similar attacks in the past.",world
Trump says energy-efficient light bulbs make him look orange,"During his speech to House Republicans in Baltimore, US President Donald Trump claimed that energy-efficient light bulbs, which his administration has tried to block, make him look orange. He described energy-efficient light bulbs as ""many times more expensive than that old, incandescent bulb that worked very well"", adding that energy-efficient light bulbs' ""light's no good"".",world
"Pak delegation skips SCO conference in Delhi, attends only dinner",A Pakistani delegation skipped the Shanghai Cooperation Organisation (SCO) military medicine conference organised in Delhi on Thursday and only attended the dinner later that evening. The inaugural session of the two-day conference was addressed by Defence Minister Rajnath Singh. The conference was attended by around 27 international and 40 Indian delegates.,world
Former US priest jailed for 30 years for child sexual abuse,"Arthur Perrault, an 81-year-old former Roman Catholic priest, has been sentenced to 30 years in prison for sexually abusing an altar boy in New Mexico, US, in the 1990s, prosecutors said. Although he was convicted of abusing just one victim, prosecutors alleged that Perrault was a serial child molester who abused several young people for more than 30 years.",world
Iran-backed Houthi rebels claim drone attacks on Saudi oil facilities,Yemen's Iran-backed Houthi rebels claimed responsibility for the drone attacks on two Saudi oil facilities on Saturday. The rebels had deployed 10 drones against Saudi Aramco plants in Abqaiq and Khurais in eastern Saudi Arabia. The drone attacks sparked fires at both the facilities.,world
Ex-Zimbabwe Prez Mugabe to be buried at heroes monument,"Former Zimbabwe President Robert Mugabe will be buried at the country's National Heroes Acre. The official ceremony would be followed by a private family event at the monument for heroes of the liberation war against white minority rule. Mugabe's body arrived in Zimbabwe from Singapore on Wednesday. Mugabe, who ruled Zimbabwe for 37 years, died at the age of 95.",world
China tells state firms to take control of Hong Kong firms: Reports,"China has called on its biggest state-run firms to take control of Hong Kong companies instead of just holding stakes in them, Reuters reported. China urged representatives from nearly 100 of China's largest state-run companies to help calm the unrest in Hong Kong. The companies reportedly pledged to invest more in key Hong Kong industries, including real estate and tourism.",world
Tiananmen Square 'Tank Man' photographer Charlie Cole passes away,"Charlie Cole, one of the four photographers who captured the 'Tank Man' protester at China's Tiananmen Square in 1989, passed away at the age of 64 in Bali last week. Cole won the World Press Photo award for his picture in 1990. Cole had hidden the undeveloped film roll in the bathroom, fearing he would be searched by Chinese authorities.",world
Indian man who stole 2 mangoes from cargo at airport faces trial,"An Indian man working at a Dubai airport faced trial at a court for stealing two mangoes from a cargo consignment. The 27-year-old committed the theft in 2017. The man, who confessed to stealing the mangoes worth 6 dirhams (₹116), said he was thirsty when he opened the box containing mangoes. If found guilty, he may face a jail term.",world
US baby born on 9/11 anniversary at 9:11 pm weighs 9lb 11oz,"A US mother says her newborn daughter is a ""little miracle"" after she was born on the anniversary of the 9/11 attacks at 9:11 pm weighing 9lb 11oz. ""She is a new life amongst the devastation and destruction,"" her mother added. ""It was really exciting, especially to find some joy during a day of such tragedy,"" her father said.",world
16-year-old climate activist protests outside White House,"Swedish climate activist Greta Thunberg on Friday protested outside the White House. The 16-year-old was greeted by hundreds of mostly young people carrying signs reading 'People or Profit?' and 'Warming!', and chanting 'This is a crisis, act like it!'. Notably, US President Donald Trump is among the few global leaders who have openly questioned the science of climate change.",world
8 Indian-Americans held for distributing millions of opioid pills,"Eight Indian-Americans were arrested for their alleged involvement in the distribution of millions of opioid pills smuggled from India. The accused allegedly operated out of a warehouse in New York, where they repackaged the pills and mailed them to customers. If convicted, seven of the accused may face up to five-year jail, while the eighth accused may face 25-year imprisonment.",world
"Canada sells ₹160 cr of Iranian assets, gives money to terror victims","Canada has sold Iran's assets worth nearly CA$30 million (over ₹160 crore) and handed over the proceeds to victims of terrorist groups allegedly sponsored by the Iranian regime, according to court documents. The confiscated assets include two Iranian-owned buildings in Ottawa and Toronto, around CA$2.6 million (nearly ₹14 crore) seized from Iranian bank accounts, as well as some vehicles.",world
Afghan Taliban sends team to Russia after US talks collapse,The Taliban has sent a delegation to Russia to discuss prospects for a withdrawal of US troops from Afghanistan following collapse of talks with the US this month. Taliban said US President Donald Trump's decision to call off the peace process came at a time when both sides had resolved all outstanding issues and were about to sign an agreement.,world
Hong Kong WTA event postponed as court reserved for protests,"The WTA Hong Kong Open has been postponed due to widespread pro-democracy protests. The tournament, scheduled to start from October 5, is played at Victoria Park, which happens to be one of the main gathering points for the mass protests. ""[A] smooth running of the tournament can be better assured at a later time,"" the Hong Kong Tennis Association stated.",world
"ABVP wins 3 posts including Prez, NSUI 1 in DU Students Union polls","The Akhil Bharatiya Vidyarthi Parishad (ABVP) has won three out of the four top posts in Delhi University Students Union polls. ABVP bagged the top posts of President, Vice President and Joint Secretary, while the National Students' Union of India (NSUI) won the post of Secretary. The overall polling percentage was recorded at 40%, Chief Election Officer Ashok Prasad said.",politics
Shah Faesal withdraws habeas corpus plea challenging detention,Bureaucrat-turned-politician Shah Faesal on Thursday withdrew his habeas corpus plea challenging his detention before the Delhi High Court. The bench allowed Faesal to withdraw his plea after his wife filed an affidavit in this regard and told them that she had received instructions to withdraw the plea when she met him in custody in Srinagar. ,politics
"NCP MP Udayanraje joins BJP in Maharashtra, says 'inspired by PM'","Senior NCP leader Udayanraje Bhonsle on Saturday resigned as Lok Sabha MP and joined BJP in the presence of party President Amit Shah and Maharashtra CM Devendra Fadnavis. ""I'm inspired by the works and leadership of PM (Narendra) Modi, Amit Shah and BJP,"" Bhonsle said. The move comes ahead of Maharashtra Assembly elections scheduled to take place in October.",politics
PM Modi's presence became bad luck for ISRO: Kumaraswamy,"Former Karnataka Chief Minister HD Kumaraswamy held PM Narendra Modi responsible after Chandrayaan-2's Vikram lander lost contact with the ground station. ""PM came to Bengaluru to give a message that he himself was landing Chandrayaan-2...he came just for sake of advertisement,"" he said. ""Once he stepped in the ISRO Centre, I think it became bad luck for scientists,"" Kumaraswamy added.",politics
Don't want to see the whole film: Sibal on PM Modi's 'trailer' remark,"Responding to PM Narendra Modi's remark that in the last 100 days of NDA government, the nation has seen ""its trailer, the film is remaining"", Congress leader Kapil Sibal said, ""We don't want to see rest of the film."" Sibal stated that in the last 100 days, GDP, GST collections and investments have gone down while unemployment has increased. ",politics
We're in midst of a protracted economic slowdown: Manmohan Singh,"Former PM Manmohan Singh said PM Narendra Modi's talk of making India a $5-trillion economy by 2024 resembles a ""pipe dream"" as for this ""we need growth rate of 12% per annum in nominal terms and 9% in real terms."" The atmosphere is one of ""gloom and doom"" and ""we're in the midst of a protracted economic slowdown,"" he added.",politics
Not needed: Gadkari after Kejriwal announces odd-even scheme,"After Delhi Chief Minister Arvind Kejriwal announced the return of the odd-even scheme in the National Capital, Union Transport Minister Nitin Gadkari stated, ""No, I don't think it is needed."" Gadkari added, ""The Ring Road we have built has significantly reduced pollution in the city and our planned schemes will free Delhi of pollution in the next two years.""",politics
"SIT questions Chinmayanand for 7 hours, seals his bedroom","BJP leader Swami Chinmayanand was questioned by a Special Investigation Team (SIT) for seven hours on Thursday in connection with allegations that he raped a 23-year-old law student. The SIT, formed on the orders of the Supreme Court, also sealed Chinmayanand's bedroom. Meanwhile, it also questioned the principals of two colleges where the law student studied.",politics
AAP MLA Som Dutt sent to Tihar jail for 6 months in 2015 assault case,"A Delhi court on Thursday sent Aam Aadmi Party (AAP) MLA Som Dutt to Tihar jail for six months, dismissing his appeal against his conviction in an assault case. In July, Delhi's Rouse Avenue Court had said that Dutt assaulted a man 'without provocation' in 2015. The court had also imposed a ₹2 lakh fine on him.",politics
Amit Shah sweeps AIIMS floor as part of campaign for PM's b'day week,"BJP President Amit Shah with working President JP Nadda swept the floor at AIIMS as part of the party's 'Seva Saptah' campaign launched to celebrate PM Narendra Modi's birthday, which is on September 17. Party leaders Vijay Goel and Vijender Gupta were also seen sweeping the floor. The leaders also visited the patients admitted in the hospital.",politics
Can't destroy greatness: Priyanka after Gandhi ji's statue vandalised,"A Mahatma Gandhi statue was vandalised by unidentified miscreants at a college in Uttar Pradesh's Jalaun. Reacting to this, Congress leader Priyanka Gandhi Vadra said, ""You cannot move even a fraction of greatness of these great men by attacking their statues."" ""This is the achievement of cowards in their life, who break the statues of great people,"" she added.",politics
"Leader dresses up as groom, workers as 'baraatis' to meet Akhilesh","Samajwadi Party (SP) leader Firoz Khan dressed up as a groom and was accompanied by party workers pretending to be 'baraatis' to meet former Uttar Pradesh CM and party President Akhilesh Yadav in Rampur. Some SP leaders have alleged that they are being prevented from meeting Akhilesh or going to Rampur, while the district administration denied putting such restrictions.",politics
People stared at me when I told my name: MK Stalin on 1989 Russia trip,"Speaking about his visit to Russia in 1989, M Karunanidhi's son and DMK President MK Stalin said, ""At a Russian airport, I was asked to mention my name. When I said 'Stalin' many people...started looking at me."" He stated that officials asked him several questions while checking his passport, adding, ""Many people in Russia didn't like Joseph Stalin.""",politics
Sardar Patel's pain removed by great son of Guj: Prasad on J&K,"Discussing abrogation of Article 370, Union Minister Ravi Shankar Prasad on Wednesday stated, ""Pain of Sardar Patel regarding Kashmir has been cured through surgery by another great son of Gujarat, Narendra Modi."" Prasad said he got emotional when he had to sign a file on the move, and claimed Home Minister Amit Shah told him, ""We want to make history.""",politics
UP govt attacking journalists who seek answers: Priyanka,"Congress leader Priyanka Gandhi Vadra on Thursday alleged that BJP government in Uttar Pradesh is constantly attacking journalists who seek answers from it. ""Their job is to make news on public issues and seek answers from the government,"" she tweeted. Recently, a journalist was arrested for allegedly shooting a video of kids mopping school floor in UP's Azamgarh.",politics
Why is govt confused on economy: Priyanka on Ola-Uber remarks,"Congress' Priyanka Gandhi Vadra on Thursday said that before elections government stated that Ola and Uber increased employment and it's now blaming them for automobile sector's slowdown. ""Why is BJP government so confused about the economy?"" she added. Earlier, Finance Minister Nirmala Sitharaman said millennials choosing Ola and Uber over buying vehicles has led to automobile sector's slowdown.",politics
BJP is standing with Chinmayanand: AAP leader Sanjay Singh,"AAP leader Sanjay Singh on Thursday alleged that BJP is ""standing"" with its party leader Swami Chinmayanand, who has been accused of physically exploiting a law student. ""She (the victim) submitted proof...to SIT and it's also available with the media but it has maintained silence,"" Singh said. The student has accused Chinmayanand of physically exploiting her for one year.",politics
Finance Minister's comments on inflation were shocking: Cong,"After Finance Minister Nirmala Sitharaman's press conference on Saturday about the current economic situation among other issues, Congress termed her comments on inflation as shocking. ""She said inflation is under control...She didn't announce any measures to address the current economic situation,"" Congress leader Anand Sharma said. ""BJP...lacks the vision to revive the economy,"" Sharma added.",politics
Economy in grim state but govt indulging in vendetta politics: Sonia,"Congress interim President Sonia Gandhi on Thursday said the economic situation in the country is very grim, but the government is indulging in ""vendetta politics"". ""Losses are mounting. All that the government is doing is indulging in unprecedented vendetta politics to divert attention from mounting losses,"" she added. ""Democracy is at peril,"" Sonia further said.",politics
"Pledge to fight for Muslim sisters, develop J&K and Ladakh: PM","Prime Minister Narendra Modi on Thursday asserted that his government has taken several measures to remove corruption, bring about development and root out terrorism. ""We pledge to...fight for the rights of Muslim sisters,"" PM Modi added. ""We aim to bring about development in Jammu & Kashmir and Ladakh, the work for which has begun,"" the PM further said.",politics
Govt should reconsider its decision on traffic fines: Kamal Nath,"Madhya Pradesh CM Kamal Nath on Thursday said the government must reconsider the quantum of penalties for traffic violations and give relief to the people. ""We also want to put a stop on road accidents...but it must be seen that the penalty is not unviable,"" he added. Penalties should be in accordance with people's paying capacity, Nath further said.",politics
I did more work than an elected govt: J&K Guv Satya Pal Malik,"J&K Governor Satya Pal Malik on Saturday said that he has managed to change people's perception towards Governor's post and has worked more than an elected government. People think Governors play golf and do nothing, he said. ""But the...work that we've done in past one year, I don't think even an elected government does that much work,"" Malik added.",politics
We should respect all languages equally: Mamata Banerjee,"West Bengal CM Mamata Banerjee on Saturday wished people on Hindi Diwas and said everybody should respect all languages and cultures equally. Her statement came after Home Minister Amit Shah said Hindi which is spoken the most can unite the country. ""We may learn many languages but should never forget our mother-language,"" she tweeted.",politics
It is India not Hindiya: DMK over Shah's Hindi Diwas tweet,"DMK President MK Stalin on Saturday criticised Home Minister Amit Shah's tweet on Hindi Diwas and asked him to withdraw his statement. Earlier today, Shah tweeted that Hindi can play a key role in 'uniting the country' and urged people to use it more. ""Unity in diversity is the foundation of this country...this is India, not Hindiya,"" Stalin said.",politics
Starting 462 Eklavya schools for tribal youth's development: PM,"Prime Minister Narendra Modi on Thursday said that for the development and education of tribal children and youth, his government is starting a ""big project"". ""We're setting up 462 Eklavya Model Residential Schools (EMRS) across the country,"" he added while addressing a gathering in Ranchi. The EMRS are aimed at providing quality education to the Scheduled Tribes' children.",politics
Disney CEO resigns from Apple board ahead of Apple TV+ launch,"Walt Disney CEO Bob Iger resigned from Apple's board of directors on September 10, regulatory filings revealed. This comes ahead of the launch of Apple's recently unveiled video streaming subscription service Apple TV+, which stands as a direct rival to the entertainment conglomerate's own service, Disney+. Iger became an Apple director shortly after Apple Co-founder Steve Jobs' death in 2011.",business
We're in midst of a protracted economic slowdown: Manmohan Singh,"Former PM Manmohan Singh said PM Narendra Modi's talk of making India a $5-trillion economy by 2024 resembles a ""pipe dream"" as for this ""we need growth rate of 12% per annum in nominal terms and 9% in real terms."" The atmosphere is one of ""gloom and doom"" and ""we're in the midst of a protracted economic slowdown,"" he added.",business
Zomato suspends its 'Infinity Dining' programme,"Zomato has suspended its 'Infinity Dining' programme from its app amid issues with restaurants over ""deep and unsustainable"" discounting. Introduced in July, the 'Infinity Dining' programme allowed Zomato Gold subscribers to order unlimited food and drinks at a set price from the menu of partner restaurants for a limited period of time.",business
India to organise Dubai-like mega shopping festival in 4 places,"Finance Minister Nirmala Sitharaman on Saturday announced that India will organise an annual mega shopping festival in four places across the country in March 2020 to promote exports. The shopping festival will be on the lines of Dubai Shopping Festival, she added. It will focus on four themes — gems and jewellery, handicraft/yoga/tourism, textiles, and leather.",business
"Govt announces ₹20,000 crore fund for stuck housing projects","The government has said it will create a fund to provide last-mile funding to affordable and middle-income housing projects, benefitting 3.5 lakh homebuyers. The government will contribute ₹10,000 crore to the fund while outside investors will bring in another ₹10,000 crore. The funding will be made available for projects that are not in bankruptcy process or classified as non-performing assets. ",business
China tells state firms to take control of Hong Kong firms: Reports,"China has called on its biggest state-run firms to take control of Hong Kong companies instead of just holding stakes in them, Reuters reported. China urged representatives from nearly 100 of China's largest state-run companies to help calm the unrest in Hong Kong. The companies reportedly pledged to invest more in key Hong Kong industries, including real estate and tourism.",business
Fires at Saudi Aramco oil facilities after drone attacks,"Drone attacks on two oil facilities owned by Saudi Arabia's state-owned oil giant Saudi Aramco in Abqaiq and Khurais provinces on Saturday caused fires, a Saudi interior ministry spokesman said without identifying the source of the drones. A Saudi-led military coalition has been battling Yemen's Houthis rebels since March 2015, and the latter have launched similar attacks in the past.",business
"Facebook VP counters Ambani, says data is not oil to be hoarded","Countering Mukesh Ambani, Facebook VP (Global Affairs) Nick Clegg said data isn't the new oil and countries like India shouldn't hoard it within national boundaries. The value of data comes from allowing it to flow freely and encouraging the innovation that comes from it, Clegg added. Ambani had said India's data must be owned by Indians and not by corporates.",business
Real estate lender Altico defaults as chief Naina Lal Kidwai quits,"Altico Capital, a lender to real estate companies, said it has defaulted on interest payment of ₹19.97 crore due on September 12 to Dubai-based Mashreqbank. The default occurred on a principal of ₹340 crore, said Altico, whose Chairperson Naina Lal Kidwai, former head of HSBC India, resigned earlier this month. Flipkart Co-Founder Sachin Bansal is reportedly among Altico's lenders.",business
"US, China tariffs could lower global GDP by 0.8% in 2020: IMF","The International Monetary Fund (IMF) on Thursday said that tariffs imposed or proposed by the US and China could lower global economic output by 0.8% in 2020. The impact of the US-China trade war and other trade disputes is now being felt, IMF spokesman Gerry Rice said. He added that the tariffs could trigger additional losses in future years.",business
London Stock Exchange rejects Hong Kong Exchanges' $39 bn takeover bid,London Stock Exchange (LSE) board has unanimously rejected Hong Kong Exchanges and Clearing's $39 billion takeover offer. The 300-year-old British bourse said it remains committed to its proposed acquisition of financial information provider Refinitiv. Hong Kong Exchanges said its takeover would only happen if the LSE ended its deal with Refinitiv.,business
India may sell Bharat Petroleum to foreign oil company: Reports,"India is planning to sell Bharat Petroleum Corporation (BPCL) to a global oil company, according to reports. The government currently holds a 53.3% stake in the country's second-largest state-owned refiner. Selling the stake can help the government meet more than 40% of the ₹1.05 lakh crore disinvestment target for the ongoing financial year based on BPCL's Thursday closing price.",business
Delhi Police investigates Budweiser owner in tax evasion case,"Delhi Police is investigating a case of alleged tax evasion involving Budweiser owner AB InBev after receiving a request from the Delhi government. Local authorities barred AB InBev in July from selling its beer in Delhi for three years over alleged tax evasion. Delhi Police said it would conduct its own probe before registering a formal case.

",business
Govt imposes $850/tonne minimum export price to curb onion shipments,"The government has imposed an $850 (₹60,300) per tonne minimum export price on onion shipments to discourage the vegetable's exports and bring down local prices. Mumbai-based Onion Exporters' Association said no one would buy from India at this price. Wholesale prices in India's largest onion trading hub, Lasalgaon in Maharashtra, have nearly doubled in a month to ₹29,500 per tonne.",business
Infosys' Gopalakrishnan to head govt panel on non-personal data,The Ministry of Electronics and Information Technology (MeitY) has constituted a committee to study issues related to non-personal data and to come up with related data governance framework. The eight-member committee will be headed by Infosys Co-Founder Kris Gopalakrishnan. The panel was formed based on the recommendations of the Justice BN Srikrishna committee on protection of personal data.,business
Polish flag carrier enters India after 25 yrs with Warsaw-Delhi route,"Poland's flag carrier, LOT Polish Airlines, on Thursday started Warsaw-Delhi direct flight, which is slated to fly five times a week. LOT Polish had discontinued its regular flight between the two capitals via Tashkent in 1994. The airline, which is a part of the Star Alliance, also has a codeshare agreement with Indian national carrier Air India.
",business
India's economic growth is much weaker than expected: IMF,"The International Monetary Fund (IMF) spokesperson Gerry Rice has said that the recent economic growth in India is ""much weaker than expected"". He said that it's weaker mainly due to ""corporate and environmental regulatory uncertainty"" and ""lingering weakness in some non-bank financial companies"". In July, IMF had cut India's GDP growth forecast for 2019-20 to 7% from 7.3%. ",business
